"id","title","body","userId"
"95","Sirloin tongue tail doner fatback, meatloaf short ribs pancetta chislic.","Shoulder prosciutto ham buffalo ham hock meatball.  Prosciutto ham tail kevin tri-tip pork belly burgdoggen sirloin corned beef.  Shankle meatball turkey flank capicola.  Buffalo frankfurter ham shankle landjaeger sausage short loin.  Short ribs swine turkey tenderloin landjaeger brisket strip steak pork belly meatloaf ground round turducken porchetta.","15"
"96","Bresaola pork belly chuck brisket shoulder pork loin ham pancetta burgdoggen jowl.","Ribeye shoulder chislic pancetta shank biltong.  Tenderloin andouille spare ribs swine ribeye pork chop.  Porchetta shankle beef short ribs frankfurter chuck chicken turkey.  Burgdoggen ham tail, ball tip tenderloin salami kielbasa tongue sausage pork belly chislic capicola meatball turducken.","4"
"97","Porchetta tongue short ribs pork landjaeger drumstick fatback sausage cupim doner pork chop frankfurter alcatra prosciutto.","Turkey cupim jerky, fatback drumstick kielbasa shoulder tenderloin pork bresaola sausage corned beef alcatra shankle.  Capicola burgdoggen pork meatloaf beef ribs.  Rump brisket andouille pork loin ground round alcatra tri-tip ham hock sausage beef ribs venison jowl shoulder flank.  Brisket beef bacon frankfurter, tenderloin kielbasa ham hock ribeye chuck.","5"
"98","Corned beef sausage swine alcatra, hamburger ribeye porchetta cow beef tail meatball.","Pork chop pancetta landjaeger filet mignon, beef ribs bacon meatloaf tenderloin kevin jerky swine alcatra ground round.  Biltong chislic kevin fatback strip steak brisket pork belly.  Short ribs frankfurter kevin shank, rump tail t-bone pork pork chop hamburger turducken swine filet mignon chislic.  Pig filet mignon flank ham hock salami cupim.  Pork belly shank meatball chuck.  Fatback meatball shank frankfurter short loin.  Buffalo kielbasa leberkas drumstick sausage venison shoulder chislic.","5"
"99","Spare ribs beef ribs shoulder, strip steak jerky ham burgdoggen chuck.","Chicken ham porchetta corned beef beef tenderloin.  Kevin pork flank spare ribs, ribeye ham chuck shank tail sausage salami.  Capicola venison doner drumstick landjaeger, sirloin ham swine kielbasa pork chop.  Hamburger andouille tenderloin pork frankfurter alcatra.  Leberkas capicola sirloin bresaola jerky.  Pork loin cupim pork frankfurter shoulder swine boudin ground round sausage, pastrami drumstick flank pancetta bacon sirloin.  Shoulder frankfurter pastrami, pork belly tenderloin beef ribs ribeye.","7"
"100","Boudin picanha t-bone, frankfurter corned beef drumstick strip steak.","Short loin alcatra drumstick jowl chislic shank ham hock boudin, hamburger biltong porchetta tri-tip.  Pastrami turkey beef, strip steak ham hock tenderloin shank burgdoggen boudin shoulder tail cupim chuck.  Meatball pork chop pig frankfurter hamburger, ribeye ball tip.  Shankle beef ribs sirloin, short loin meatloaf pork chop capicola brisket corned beef hamburger.  Pork filet mignon picanha meatloaf pastrami, swine sirloin pig shankle pancetta venison porchetta tail sausage pork belly.","7"
