"id","title","body","userId"
"47","Ham burgdoggen drumstick sausage pork chop strip steak jowl.","Cupim salami boudin short ribs fatback bacon jerky biltong.  Ham pork belly sausage, turkey jowl turducken picanha corned beef drumstick ground round tongue meatloaf beef buffalo.  Salami filet mignon ribeye, t-bone pancetta pork belly turkey prosciutto.  Meatloaf pork chop prosciutto, ham frankfurter ribeye swine spare ribs ball tip filet mignon.  Ground round fatback corned beef beef ribs ball tip chuck andouille pork chop shankle salami ham hock.  Corned beef filet mignon jowl pork chop, chicken shankle ribeye frankfurter venison spare ribs swine.  Buffalo tongue kevin, landjaeger capicola flank kielbasa pork doner filet mignon swine bacon jerky pork belly.","21"
"48","Turkey turducken flank drumstick shank.","Burgdoggen brisket strip steak, cow pastrami andouille meatball ribeye short ribs rump flank tenderloin bacon.  Salami ground round corned beef, sausage meatball leberkas flank chuck bresaola pastrami brisket cow ball tip beef.  Pancetta fatback tail beef.  Pork chop turducken flank, rump meatball swine buffalo pork loin beef ribs frankfurter ham hock bacon t-bone.","19"
"49","Rump flank capicola chicken chuck filet mignon tail turkey.","Pork loin andouille tri-tip swine chislic filet mignon beef ribs beef.  Rump cow bresaola cupim, shoulder kevin short ribs chuck.  Tongue swine salami frankfurter tri-tip, pork shankle chicken bresaola shoulder burgdoggen t-bone short loin shank.  Corned beef chicken fatback ground round, tongue capicola short loin.  Chislic tenderloin burgdoggen pork belly.  Porchetta beef spare ribs, chislic prosciutto chicken pig.  Leberkas tail drumstick short loin ham sausage salami tongue bresaola ham hock jowl cow strip steak.","6"
"50","Tri-tip porchetta tongue pork loin pig tail beef ribs pork belly chicken sirloin landjaeger capicola ribeye t-bone.","Pork belly bacon beef, short loin burgdoggen meatball alcatra ribeye boudin porchetta rump ham t-bone andouille tri-tip.  Venison corned beef meatball, ham hock frankfurter beef ribs porchetta.  Shoulder jowl tail prosciutto chislic beef turducken ham hock ribeye biltong swine chicken.  Biltong porchetta ham tri-tip, brisket ground round burgdoggen short loin ball tip chuck jerky beef ribs andouille.","16"
"51","Andouille chicken t-bone ribeye tail pig landjaeger filet mignon shank chislic fatback swine pancetta kevin.","Picanha short ribs meatloaf shoulder flank sausage.  Short loin ball tip salami, chuck pork chop pork loin chislic bresaola.  Biltong turducken ground round, ham hock leberkas ribeye sausage tri-tip.  Andouille picanha buffalo, short loin beef ribeye tail.  Pork chop prosciutto chicken beef, flank leberkas chislic.  Beef ribs shank chicken leberkas prosciutto.","17"
"52","Turducken turkey rump chislic ribeye.","Pig flank cow chicken ham hock cupim tri-tip burgdoggen short ribs spare ribs.  Salami strip steak beef alcatra bresaola sirloin short ribs tail.  Short loin ribeye bacon, flank strip steak shoulder beef ribs pastrami.  Boudin pastrami chicken, shank fatback capicola ham hock ribeye bacon t-bone sirloin corned beef burgdoggen.  Strip steak ball tip chuck, pastrami ham hock pork loin andouille alcatra tri-tip beef capicola.","14"
"53","Capicola ribeye spare ribs biltong leberkas.","T-bone turkey venison landjaeger bresaola andouille.  Burgdoggen doner buffalo pastrami short ribs fatback.  Chuck buffalo beef ribs, ribeye pork chop pig landjaeger.  Drumstick pancetta hamburger alcatra meatloaf chicken turkey shoulder short loin shank tongue.  Flank jowl doner turducken chislic shoulder ball tip pancetta short ribs bacon spare ribs.","23"
"54","Sausage swine bacon burgdoggen, spare ribs pork loin cow ground round jerky kielbasa pastrami prosciutto.","Strip steak tri-tip filet mignon swine, tail prosciutto turducken burgdoggen bresaola capicola brisket biltong sirloin.  Shank fatback chislic, flank picanha tenderloin hamburger.  Ham hock rump swine cupim, kevin tenderloin pancetta spare ribs tri-tip beef ribs brisket salami t-bone pork.  Picanha kielbasa ball tip porchetta shank.","18"
"55","Brisket hamburger cupim ham hock jowl pancetta jerky boudin shank prosciutto capicola shoulder chislic pork chop.","Hamburger jerky cupim sirloin ground round bresaola porchetta bacon brisket corned beef alcatra fatback boudin.  Jerky beef fatback rump swine short ribs.  Shoulder jerky prosciutto pork chop fatback rump.  Tongue andouille bacon swine boudin tenderloin fatback.  Filet mignon tenderloin andouille prosciutto ball tip.  Ground round capicola burgdoggen spare ribs pork belly cow pancetta chicken pork chop turducken sausage bacon.","21"
"56","Doner meatloaf flank ground round meatball cow filet mignon capicola ribeye boudin bresaola short loin alcatra pork loin.","Alcatra capicola pork belly beef ribs pork chop filet mignon venison corned beef pig short ribs.  Doner beef ribs corned beef shank andouille.  Meatloaf chicken shankle doner shoulder chislic porchetta corned beef.  Tri-tip capicola turkey biltong meatloaf tail.","5"
"57","Beef ribs chicken salami pork chop frankfurter rump.","Tongue frankfurter meatball picanha buffalo tri-tip.  Landjaeger pork loin porchetta tail short loin beef ribs doner prosciutto pork belly kielbasa drumstick.  Tenderloin meatloaf filet mignon landjaeger brisket, cow strip steak chuck.  Capicola tri-tip cupim pork belly burgdoggen short loin meatloaf corned beef pig tail picanha buffalo bresaola ball tip chuck.  Tenderloin sirloin bresaola, boudin ham hock rump kevin shank.  Brisket sausage buffalo doner boudin ribeye bresaola, pork chop kevin jowl.  Turkey pig hamburger ball tip, leberkas pork chop biltong capicola burgdoggen tail frankfurter.","8"
"58","Brisket boudin ground round corned beef doner.","Andouille pork chop cupim cow bacon short loin beef tenderloin sirloin pork burgdoggen prosciutto kielbasa landjaeger.  Fatback t-bone turducken venison shank ham hock bacon short loin pork loin porchetta sausage capicola.  Brisket flank ribeye beef ribs cow.  Strip steak fatback chuck venison buffalo turkey rump tri-tip pastrami flank.","19"
"59","Pig sausage kielbasa pork loin.","Boudin meatball pig jowl.  Burgdoggen pork chop swine turducken chuck pork belly ribeye sirloin short loin filet mignon kevin biltong landjaeger ground round.  Pancetta jerky tri-tip, corned beef cupim alcatra shank frankfurter capicola andouille.  Ham hock chicken hamburger venison porchetta drumstick ribeye.  Rump chicken jowl jerky kevin pork belly prosciutto spare ribs biltong ribeye picanha pig.  Tongue chicken jowl venison pastrami pork chop salami.","20"
"60","Drumstick chuck shoulder, pastrami meatball cupim tongue.","Brisket kielbasa bresaola drumstick fatback venison.  Short ribs spare ribs tenderloin, turducken meatloaf chicken t-bone porchetta ribeye pancetta flank boudin tongue.  Ham hock pork belly kielbasa rump.  Tenderloin porchetta biltong, ribeye rump kielbasa tail brisket jerky ham hock ham.  Hamburger turducken bresaola ham, tri-tip pork loin meatball porchetta andouille.  Pig brisket swine chicken prosciutto.","1"
"61","Jerky shoulder turkey corned beef drumstick short ribs beef filet mignon prosciutto.","Tail pastrami short ribs turducken capicola swine landjaeger beef picanha tongue pork chop.  Turkey beef flank ribeye buffalo tongue boudin brisket.  Picanha frankfurter beef ribs fatback turkey salami ham strip steak.  Meatloaf jowl venison pancetta hamburger buffalo doner sausage boudin pork loin cow turkey.","14"
"62","Spare ribs ham hock pork belly tail filet mignon pork short ribs.","Beef flank sausage, kevin rump pig pancetta prosciutto tri-tip venison andouille tongue capicola pork loin swine.  Pancetta jerky buffalo, sirloin pork belly kielbasa boudin.  Brisket pastrami ribeye, chislic boudin biltong pork belly bacon buffalo cow spare ribs chicken.  Tongue hamburger turkey sirloin, strip steak boudin burgdoggen.  Andouille shank chislic kevin, frankfurter beef ribs pork chop biltong jerky short loin chuck prosciutto.  Tongue flank venison swine fatback andouille jowl short ribs.  Doner andouille pancetta, rump burgdoggen ball tip ground round boudin beef ribeye biltong fatback.","13"
"63","Sausage ham hock pastrami shankle cow biltong sirloin tri-tip pork belly bacon.","Kielbasa rump salami ball tip.  Porchetta frankfurter burgdoggen andouille, leberkas pork belly ground round ball tip drumstick turducken pig capicola venison ham hock t-bone.  Tongue bacon alcatra, ball tip sirloin drumstick cupim brisket pork ham filet mignon boudin.  Chicken tongue porchetta chuck beef fatback capicola short loin.  Kevin beef ribs spare ribs short ribs, porchetta picanha leberkas bacon sirloin buffalo strip steak jerky ham hock.","14"
"64","Porchetta short loin pastrami spare ribs beef ribs flank cupim rump biltong turducken landjaeger turkey.","Frankfurter ball tip turkey ribeye, capicola biltong alcatra pork belly rump bresaola jowl cow buffalo.  Prosciutto turducken spare ribs brisket, chislic pork picanha bresaola kielbasa ground round landjaeger.  Pig chicken tongue turducken fatback cupim ham hock.  Chicken spare ribs biltong porchetta, bresaola corned beef cow pork venison capicola.  Capicola biltong strip steak ribeye jowl turkey cow.  Drumstick bresaola shank cow, porchetta pork chop jerky.","13"
"65","Boudin cow jowl frankfurter, turducken doner t-bone sausage meatball capicola pork pork belly cupim strip steak.","Jowl bresaola kielbasa rump, andouille doner spare ribs.  Swine fatback shoulder jerky doner.  Doner rump tail sirloin shankle chislic t-bone turkey spare ribs brisket shank porchetta.  Rump fatback pork chop flank tri-tip chicken.","16"
"66","Tail buffalo bresaola pork loin short ribs.","Beef picanha shank doner, pastrami tenderloin jowl t-bone pork belly.  Doner bresaola short ribs cupim biltong t-bone fatback.  Ground round ribeye tenderloin ham hock cupim kielbasa cow strip steak.  T-bone shankle prosciutto chicken pork chop.  Corned beef venison flank, beef shankle tongue pork tail bacon ham boudin jowl rump pork belly picanha.  Drumstick jowl capicola, boudin pork loin meatloaf andouille ham hock bacon beef ribs ham doner.","10"
"67","Ham tail kevin pork loin, flank pork belly short loin.","Sausage rump turkey, bacon venison salami short loin ham flank burgdoggen andouille.  Pork chop cow meatloaf, flank salami boudin alcatra fatback leberkas t-bone chicken.  Rump cow turkey brisket, pork ball tip fatback pork belly beef ribs leberkas chislic filet mignon.  Pig pork chop picanha kevin chuck.  Strip steak short loin flank chislic frankfurter filet mignon rump short ribs.","9"
"68","Kevin doner flank pork sirloin.","Pastrami short ribs tri-tip jerky.  Bresaola pork loin alcatra pastrami.  Pork belly alcatra pastrami brisket jerky.  Jerky ground round shoulder ham short loin kielbasa.  Jowl sirloin bresaola burgdoggen, turducken venison pork belly ball tip andouille pork loin tail swine shankle.  Cupim leberkas flank, chislic capicola buffalo bacon.","14"
"69","Sausage brisket flank prosciutto jerky jowl tongue hamburger ham hock bacon ball tip boudin.","Meatloaf tri-tip turkey pastrami tongue hamburger shoulder kevin short loin.  Doner chuck short loin biltong t-bone alcatra ham hock sirloin corned beef shank flank tri-tip frankfurter fatback meatball.  Sausage meatball tenderloin ball tip pork belly swine pastrami tail jerky fatback.  Pork fatback pancetta tri-tip, turkey prosciutto sirloin andouille salami ball tip jowl swine bacon tongue.  Frankfurter pastrami drumstick beef ribs, alcatra ball tip tri-tip tongue cow biltong.","23"
"70","Meatball ball tip flank shank short loin venison filet mignon bacon t-bone andouille.","Swine drumstick pork loin venison strip steak.  Andouille boudin landjaeger biltong corned beef pork loin alcatra bresaola.  Frankfurter doner pork loin buffalo brisket turducken burgdoggen porchetta corned beef tongue kevin.  Tongue strip steak ball tip pastrami chislic pork chop.  T-bone pastrami buffalo tenderloin bresaola.  Brisket pig andouille, jerky pastrami tail pork turducken chicken.","11"
"71","Tri-tip ball tip meatloaf jerky.","Biltong porchetta rump, picanha tongue shank boudin frankfurter doner.  Pig drumstick ground round ribeye bresaola, buffalo kielbasa ham.  Pastrami tail flank short loin buffalo short ribs meatball corned beef hamburger doner.  Kevin sausage pig buffalo leberkas, boudin filet mignon.  Kevin venison strip steak pancetta tail shank landjaeger beef ball tip, pork loin tongue filet mignon turducken.  Short ribs corned beef tongue alcatra pork chop turducken venison flank leberkas doner.","16"
"72","Beef ribs pastrami burgdoggen pork prosciutto ground round chicken corned beef spare ribs rump ham kielbasa.","Tail kevin turkey beef ribs tenderloin.  Hamburger ball tip ground round salami sirloin sausage pork loin pork.  Rump bacon fatback sausage cupim capicola pork biltong shoulder.  Sausage porchetta rump fatback.  Biltong shankle kielbasa prosciutto, kevin doner flank.  Drumstick shank short ribs, pork belly ground round doner meatloaf ham salami tenderloin kielbasa pancetta shoulder.  Tail kielbasa jowl swine turducken pork chop chuck tongue flank, salami chislic.","5"
"73","Corned beef filet mignon tenderloin jowl.","Salami pancetta chislic buffalo.  Chislic capicola meatball leberkas, rump sirloin filet mignon swine hamburger pancetta.  Chicken leberkas pig cow, jowl tri-tip meatball corned beef beef ribs kielbasa landjaeger.  Turkey cupim ham, chuck frankfurter leberkas pork belly kielbasa ground round meatloaf burgdoggen tenderloin kevin chislic.  Alcatra ribeye meatball, fatback cow flank tail rump short ribs burgdoggen pastrami.  Ham hock pork loin landjaeger, flank strip steak biltong cow boudin jowl.","9"
"74","Sirloin brisket short loin picanha sausage chuck filet mignon boudin.","Beef ribs filet mignon ball tip prosciutto frankfurter strip steak, ham chuck t-bone.  Beef pork loin meatloaf rump pork belly corned beef boudin bacon, pork venison sirloin t-bone.  Picanha jowl pig, kielbasa meatball corned beef swine landjaeger pork loin sirloin buffalo tail.  Ground round filet mignon pastrami beef ribs t-bone, shoulder swine tenderloin tongue tail.  Beef ribs pig jerky beef pastrami.  Meatball meatloaf capicola tongue pork belly venison bacon.  Kielbasa pork loin tail flank sirloin.","22"
"75","Meatloaf ball tip drumstick ham, swine prosciutto rump kevin kielbasa leberkas meatball venison frankfurter fatback chuck.","Pork chop pig turducken t-bone, venison chicken burgdoggen tenderloin short ribs ribeye tri-tip chislic biltong.  Buffalo jerky ribeye alcatra frankfurter hamburger cow tongue.  Rump tail sausage pork loin.  Kevin buffalo rump frankfurter salami bacon.  Swine kielbasa hamburger pork loin ball tip ribeye, pancetta ham hock short ribs shoulder cow jerky rump sirloin ground round.","10"
"76","Chuck buffalo short ribs cupim pancetta turkey alcatra picanha ground round jowl landjaeger hamburger venison filet mignon pork loin.","Tenderloin alcatra bacon t-bone leberkas prosciutto shank fatback frankfurter filet mignon pig pork loin.  Kielbasa shankle jerky tail chuck picanha corned beef brisket tongue shank fatback sirloin turkey capicola.  Sausage ribeye pancetta brisket, alcatra ham hock fatback capicola t-bone pork belly ham kevin tri-tip beef swine.  Filet mignon jerky swine tenderloin ground round jowl ribeye picanha venison kevin cupim ball tip pork.  Meatball jerky jowl leberkas capicola spare ribs.","24"
"77","Boudin bresaola chicken ham, tri-tip chislic kevin buffalo shank pig landjaeger spare ribs doner beef porchetta.","Beef ribs drumstick short loin capicola, meatloaf flank filet mignon frankfurter fatback.  Rump drumstick ball tip pig, doner chislic cupim pastrami beef ribs cow.  Spare ribs turducken chuck, chicken short ribs beef picanha alcatra kevin turkey ground round kielbasa ribeye strip steak pork.  Pig jerky corned beef, porchetta shoulder picanha strip steak pork loin pork belly meatloaf short ribs meatball fatback.  Pastrami kevin frankfurter landjaeger, corned beef short loin brisket.  Frankfurter sirloin ball tip meatball pastrami landjaeger venison shank pork belly.","18"
"78","Chicken salami alcatra pork loin, shank frankfurter flank fatback meatball sausage.","Turkey frankfurter shank, biltong drumstick bacon filet mignon beef tri-tip sausage kevin boudin ham hock.  Leberkas chislic turkey spare ribs drumstick ham hock tail.  Porchetta jowl pork chop t-bone short loin cupim shank ground round ball tip short ribs beef ribs chicken.  Chuck turducken ham doner.  Pig drumstick leberkas, boudin ribeye ball tip pork belly tongue bresaola.  Bresaola bacon jerky, t-bone fatback flank shank ground round landjaeger ham hock tenderloin burgdoggen pastrami beef.","4"
"79","Alcatra short loin cow sausage bresaola pork shank beef flank pastrami ball tip landjaeger fatback tenderloin pig.","Andouille chuck beef doner brisket filet mignon jerky corned beef prosciutto capicola kevin pork cupim.  Chislic rump cow pig, t-bone ball tip bresaola alcatra swine andouille.  Prosciutto turkey pig, ball tip buffalo andouille porchetta landjaeger tri-tip short ribs brisket beef ribs meatball.  Pork chop salami flank filet mignon jerky.  Jerky beef ribs pancetta landjaeger short loin tenderloin sausage spare ribs biltong turkey salami pork chop strip steak sirloin.  Drumstick biltong tenderloin shank doner ribeye, turducken short loin hamburger pig cow jowl pork chop.  Sirloin pork loin tongue short loin frankfurter bresaola turkey.","5"
"80","Buffalo biltong pastrami, ground round ball tip ham sirloin leberkas shankle chuck spare ribs tri-tip landjaeger chislic burgdoggen.","Ham picanha prosciutto brisket salami drumstick strip steak filet mignon.  Pig alcatra bacon meatball, picanha pastrami salami turkey t-bone.  T-bone jowl landjaeger capicola burgdoggen sirloin strip steak bresaola drumstick bacon.  Doner fatback pork chop tail filet mignon prosciutto ham frankfurter landjaeger cow cupim chislic corned beef jerky picanha.  Shoulder pancetta shankle, bresaola short loin beef kevin pork pig porchetta buffalo.  Burgdoggen landjaeger alcatra pork loin.  Ground round pig bresaola kielbasa.","21"
"81","Prosciutto capicola pork short ribs pork chop ham.","T-bone pork jerky short loin biltong capicola meatball.  Pork belly prosciutto rump ball tip pastrami pork chop, shoulder fatback sausage meatball t-bone.  Chislic flank short loin short ribs hamburger landjaeger chicken.  Beef tongue salami ground round sirloin.","3"
"82","Tongue ground round biltong chislic ham leberkas alcatra.","Bacon meatball landjaeger picanha jowl pork chop short loin.  Flank shoulder jerky corned beef chicken.  Tri-tip beef ribs tail pig tongue corned beef chicken, biltong bresaola.  Kevin prosciutto short loin tongue meatball.  Ham hock flank porchetta cupim shoulder chislic burgdoggen beef ham fatback.  Strip steak turkey jerky shoulder salami.","3"
"83","Boudin leberkas doner turducken ham.","Ham ball tip meatball chislic capicola pastrami strip steak biltong chuck pig tongue chicken tenderloin t-bone tri-tip.  Pork chop tri-tip chicken doner.  Venison kielbasa biltong ball tip hamburger pork belly, turkey spare ribs prosciutto chicken short ribs tri-tip doner ham hock andouille.  Prosciutto cow t-bone, picanha fatback porchetta drumstick chislic swine kielbasa burgdoggen alcatra.  Cupim ham shank drumstick, landjaeger rump turducken shoulder.  Bacon ball tip jowl cupim andouille drumstick, tongue bresaola jerky beef ribs rump chicken flank chislic sausage.","22"
"84","Drumstick landjaeger rump jowl.","Beef beef ribs jerky ham hock pancetta turducken tenderloin pig swine short ribs venison pastrami meatball.  T-bone fatback flank porchetta pastrami jerky leberkas bresaola pancetta pork belly ribeye frankfurter biltong.  Capicola beef ribs tail swine.  Ball tip pork chop short loin, pancetta buffalo turducken burgdoggen tri-tip andouille biltong pork belly kielbasa.","18"
"85","Jowl beef ribs flank, landjaeger pork chop bresaola biltong chuck andouille meatball drumstick swine turducken chislic.","Beef ribs alcatra chislic, tenderloin short ribs andouille short loin boudin picanha.  Swine jowl strip steak bacon, shankle cupim landjaeger ball tip fatback meatloaf turducken shank bresaola.  Capicola frankfurter turkey turducken tongue pancetta salami.  Bacon chicken filet mignon porchetta jowl meatball jerky pork turkey andouille buffalo shoulder burgdoggen shank sirloin.  Ham hock sirloin prosciutto, short ribs buffalo rump chuck bresaola picanha.  Alcatra sirloin corned beef frankfurter, t-bone jerky ham tri-tip shankle pork kevin cupim.  Biltong prosciutto tenderloin cow sausage, chicken short ribs rump shoulder spare ribs turkey ribeye.","15"
"86","Meatball venison buffalo brisket drumstick hamburger alcatra sausage filet mignon bresaola.","Frankfurter pork chop capicola, rump flank short ribs boudin shankle alcatra jerky t-bone filet mignon chislic tongue spare ribs.  Ball tip chicken pork, biltong short ribs capicola beef ribs chislic boudin beef.  Swine landjaeger tail short loin sausage meatloaf pig.  Fatback prosciutto pork chop drumstick kielbasa flank.  Chuck shank brisket pastrami.  Beef biltong ham short loin chuck.","4"
"87","Sausage flank chislic salami doner ham hock shankle.","Hamburger frankfurter ground round rump chislic.  Ham hock turkey kevin short loin buffalo alcatra beef ribs pork belly corned beef biltong pork chop tri-tip.  Ball tip short ribs t-bone, pancetta brisket leberkas ground round shoulder bacon shank biltong chuck landjaeger venison.  Drumstick corned beef pastrami meatball turducken, buffalo boudin hamburger swine.  Pork chop landjaeger tail buffalo.  Ribeye shankle burgdoggen beef chislic, beef ribs tri-tip ground round rump pork.","6"
"88","Capicola spare ribs shoulder short ribs, ham hock ground round chicken boudin cow prosciutto drumstick doner pork chop.","Corned beef jerky meatloaf brisket strip steak tongue.  Tongue cow tri-tip, doner salami venison meatball.  Ham salami leberkas, pancetta drumstick tri-tip alcatra kielbasa shankle venison swine shank hamburger frankfurter.  Jerky burgdoggen salami, prosciutto swine jowl kielbasa pastrami ball tip beef ribs short ribs doner pork.  Leberkas pork loin hamburger tongue, cupim shoulder pork meatball kevin ground round shank rump burgdoggen venison spare ribs.","19"
"89","Salami frankfurter meatloaf, leberkas kielbasa bresaola corned beef ham hock venison flank fatback ham.","Turducken frankfurter biltong flank ribeye chislic pork loin spare ribs meatloaf picanha.  Doner tongue biltong fatback, hamburger drumstick burgdoggen brisket capicola leberkas cupim jowl buffalo.  Short ribs corned beef ground round meatball pork.  Short loin pork belly biltong, brisket shankle short ribs jerky beef sirloin fatback ground round picanha.  Burgdoggen pork loin shankle tri-tip bresaola ball tip pork chop ribeye pork capicola short loin kielbasa buffalo picanha cupim.  Cow venison leberkas short loin turducken tenderloin capicola frankfurter cupim pork loin shank.  Tri-tip picanha bacon landjaeger, turducken meatloaf beef pork belly.","1"
"90","Ham prosciutto hamburger turducken shank brisket, capicola turkey pork loin.","Prosciutto ham hock chicken pork belly, ribeye burgdoggen shoulder pork meatloaf sirloin short ribs.  Ham picanha meatloaf, ribeye rump tail turkey.  Filet mignon ham hock flank ham.  Turducken ham hock pork chislic pork loin shankle short ribs leberkas chicken corned beef pig shank sirloin beef filet mignon.  Chislic ham hock porchetta bacon corned beef t-bone meatloaf landjaeger andouille jerky.","4"
"91","Beef ribs brisket meatloaf jerky kevin pork.","Bacon pork belly boudin pork loin kielbasa turducken pork chop drumstick biltong cow.  Prosciutto pancetta kevin turkey.  Ball tip cupim jerky meatloaf picanha.  Tenderloin strip steak short ribs pancetta cupim shankle andouille salami chislic.  Meatloaf prosciutto tenderloin alcatra.  Rump chicken biltong buffalo alcatra shank.","7"
"92","Meatball jerky pastrami, t-bone ham hock bresaola boudin alcatra shank capicola.","Bacon pork loin cow, ham hock corned beef shoulder ball tip spare ribs kielbasa.  Bacon kielbasa sirloin chicken pastrami leberkas shank venison kevin pig brisket turducken tenderloin.  Buffalo boudin venison capicola shankle.  Flank ribeye ham, hamburger beef ribs beef cupim pork chop.  Turkey tri-tip bacon ham jerky boudin.  Cow andouille t-bone venison hamburger meatball strip steak leberkas.","4"
"93","Brisket corned beef boudin, pancetta ribeye drumstick capicola leberkas shank spare ribs meatloaf chicken pork chop pork loin kielbasa.","Chuck t-bone jerky cow, tongue beef capicola sausage frankfurter ham strip steak.  Drumstick pancetta hamburger strip steak biltong porchetta picanha beef pig filet mignon pork belly alcatra ham hock chuck swine.  Alcatra pig hamburger landjaeger, swine pastrami filet mignon shankle chislic pork loin doner ground round andouille.  Swine filet mignon meatloaf ribeye.  Buffalo ribeye jowl tongue biltong ham hock, turkey boudin beef ribs capicola pig turducken.","12"
"94","Pork loin cow biltong sirloin kielbasa bresaola meatloaf chicken prosciutto.","Prosciutto venison swine, alcatra ball tip landjaeger doner strip steak pork chop boudin t-bone turducken spare ribs beef ribs.  Porchetta tongue filet mignon, fatback swine pancetta ribeye meatball picanha turducken short ribs biltong hamburger.  Hamburger pork belly ribeye leberkas shank meatball.  Rump filet mignon tongue pork loin strip steak hamburger.","23"
