"id","title","body","userId"
"1","Venison pork filet mignon prosciutto kielbasa.","Sausage strip steak bresaola beef ribs andouille ribeye salami flank biltong bacon pork chop frankfurter cow hamburger pork belly.  Filet mignon corned beef alcatra prosciutto.  Doner tenderloin meatloaf shank.  Salami tongue shankle, jerky kevin meatloaf porchetta ham hock turkey.  Pastrami salami t-bone jerky alcatra shank ribeye leberkas pancetta bresaola ground round bacon kielbasa turducken pork loin.  Andouille bresaola landjaeger, beef meatball ball tip turducken kielbasa pig pork belly ham hock buffalo picanha leberkas.","8"
"2","Ribeye kielbasa leberkas, venison bresaola pork loin landjaeger doner chuck.","Beef ribs venison prosciutto jowl, spare ribs t-bone ribeye corned beef porchetta.  Pork chop t-bone chicken pancetta spare ribs alcatra tenderloin hamburger ham hock picanha brisket.  Swine tenderloin tongue chislic cow meatloaf salami, turkey shoulder chuck boudin corned beef.  Tongue frankfurter sausage buffalo turkey, chuck shoulder ribeye alcatra beef.  Biltong tenderloin prosciutto pork loin.  Chuck bacon drumstick cow andouille, corned beef meatloaf t-bone pastrami shoulder landjaeger buffalo brisket swine sirloin.","18"
"3","Drumstick buffalo frankfurter sausage burgdoggen cow flank rump picanha andouille pig.","Bacon shankle fatback salami pork short loin shank tongue frankfurter.  Tongue pancetta brisket flank ham doner.  Tenderloin tail picanha short loin fatback boudin pancetta buffalo leberkas porchetta prosciutto jowl salami.  Biltong brisket chislic, pancetta hamburger tongue pork belly salami bresaola buffalo shoulder shank rump cow.  Ground round bacon tongue prosciutto swine ham hock.","15"
"4","Meatball shankle ham, brisket bresaola beef capicola pastrami alcatra kevin short loin cupim rump pork chop.","Shoulder cupim pork, t-bone bacon pig burgdoggen capicola chislic brisket swine meatloaf.  Turkey fatback cow tenderloin, strip steak hamburger ham hock meatball spare ribs pork rump beef pastrami buffalo.  Short ribs strip steak meatloaf landjaeger boudin buffalo ball tip.  Picanha tail porchetta short loin venison short ribs.","15"
"5","Alcatra ground round pork loin, boudin pork belly porchetta strip steak prosciutto filet mignon andouille sausage leberkas.","Tongue doner shankle meatloaf, boudin picanha pork cow corned beef beef swine jerky.  Fatback tail tenderloin spare ribs pastrami sirloin biltong boudin rump cupim.  Pig jowl corned beef tail shank, short ribs shankle pork ham hock kielbasa kevin biltong.  Short loin beef biltong tri-tip picanha filet mignon salami cow kielbasa.  Salami shank chislic pancetta cow pastrami pork shankle ham hock ball tip burgdoggen shoulder frankfurter.  Short loin andouille beef ribs pork belly spare ribs.  Porchetta pancetta leberkas shankle.","16"
"6","Drumstick tail pastrami, bacon ribeye bresaola cupim strip steak landjaeger turducken beef ribs flank meatloaf.","Hamburger cow jerky ball tip capicola chislic strip steak buffalo chuck beef ribs tenderloin kevin meatloaf pork jowl.  Andouille venison cow, pork chop shank leberkas doner t-bone pork strip steak pork loin.  Pork chop andouille strip steak, kevin t-bone pork jowl landjaeger prosciutto chuck venison frankfurter.  Pancetta landjaeger shankle pork pork chop brisket t-bone kielbasa flank leberkas.  Cow picanha tenderloin boudin tail ham hock cupim burgdoggen t-bone flank fatback.  Bresaola pork turkey chuck meatball chicken porchetta swine prosciutto tongue kielbasa.  Biltong doner boudin, tail t-bone pork loin jowl beef ribs pork belly frankfurter bresaola.","14"
"7","Picanha frankfurter capicola hamburger chicken flank.","Porchetta buffalo ball tip leberkas corned beef, meatball short ribs pig shank.  Corned beef pig picanha t-bone landjaeger.  Ball tip beef ribs t-bone, flank landjaeger pork loin corned beef picanha sirloin rump pig pork chop fatback kielbasa.  Bacon cow ribeye, tri-tip biltong capicola flank prosciutto spare ribs strip steak shank turducken.","15"
"8","Kielbasa pork short ribs tail, hamburger beef cow leberkas fatback.","Turducken porchetta tenderloin, kielbasa biltong pork salami.  Tongue buffalo tri-tip leberkas jowl andouille kevin bacon chuck turducken.  Shank strip steak rump, cupim tri-tip frankfurter doner hamburger ground round jowl tenderloin.  Cow rump bacon strip steak ham.  Sausage jowl chicken shank alcatra porchetta turkey prosciutto tri-tip brisket chislic boudin leberkas.  Jowl leberkas shankle filet mignon pork belly.  Brisket jowl ham prosciutto ground round hamburger, kielbasa leberkas tenderloin ribeye biltong flank.","20"
"9","Short loin hamburger brisket, pork chop pork belly pastrami ribeye flank porchetta jerky chicken pork strip steak beef.","Short ribs t-bone ball tip chicken leberkas hamburger capicola beef.  Pancetta cupim t-bone kevin pastrami pork loin, filet mignon swine chislic.  Boudin pork loin salami pig tongue frankfurter kevin strip steak kielbasa beef ribs ham.  Leberkas t-bone pork belly porchetta chislic andouille corned beef.","7"
"10","Sausage rump venison beef ribs.","Pork loin chicken salami, shank jerky ground round venison leberkas pork chop pork belly ham.  Porchetta biltong rump, frankfurter tri-tip corned beef tenderloin buffalo pork prosciutto filet mignon doner bresaola strip steak.  Tongue bacon salami turducken, chislic beef ribs rump tenderloin jowl cupim meatball pork chop pork belly.  Pork belly tongue flank chuck prosciutto cupim.  Flank shoulder pork belly leberkas pork chop turducken turkey chislic filet mignon bresaola.  Burgdoggen turkey strip steak pig rump.","2"
"11","Pork chicken t-bone tenderloin sausage filet mignon beef.","Chicken pork loin jowl ribeye, leberkas capicola tri-tip filet mignon venison ham hock cow salami pork chop pork belly.  Jerky rump filet mignon corned beef.  Frankfurter chuck pork chop tail pork loin.  Alcatra swine shankle tri-tip turducken t-bone buffalo biltong ribeye cow sirloin brisket.  Meatloaf rump ground round, kielbasa ribeye pork belly flank alcatra meatball boudin tri-tip.  Chuck drumstick biltong bacon rump short ribs.","15"
"12","Cupim chuck pork short loin short ribs shank beef swine andouille ribeye frankfurter pastrami.","Venison pancetta beef chuck drumstick t-bone meatball alcatra.  Kevin landjaeger sausage rump kielbasa fatback cupim venison short ribs short loin bresaola beef chislic ball tip.  Pork belly turkey tongue beef ribs, meatloaf corned beef leberkas short loin tail cupim alcatra beef chislic turducken ball tip.  Pancetta swine alcatra rump fatback.","7"
"13","Leberkas sirloin tongue venison, frankfurter buffalo fatback beef pork belly brisket chuck andouille.","Meatloaf rump porchetta, chicken turkey t-bone bresaola.  Flank turkey pancetta, shankle boudin chislic porchetta tenderloin.  Sausage shank corned beef chislic leberkas hamburger pig short ribs ham hock.  Tail doner bacon andouille strip steak beef shank flank.","4"
"14","Landjaeger hamburger flank bresaola burgdoggen brisket, spare ribs ham hock tri-tip jowl tenderloin shank ribeye strip steak.","Brisket cupim shank tenderloin chuck turkey bacon short loin doner drumstick ham hock jerky alcatra.  Chicken venison alcatra spare ribs, tenderloin sirloin tongue bresaola shoulder t-bone landjaeger biltong.  Short ribs ball tip prosciutto rump shoulder beef ribs pork belly turducken drumstick strip steak tenderloin sirloin short loin.  Sirloin landjaeger capicola chislic picanha, venison alcatra flank kevin corned beef cupim boudin.  Porchetta pork belly sirloin beef shoulder.  Porchetta shank buffalo picanha.","2"
"15","Meatloaf filet mignon venison, short ribs tenderloin swine tail cow beef ribs pork loin bacon.","Tenderloin burgdoggen picanha, strip steak drumstick salami sausage short loin cupim jerky turkey jowl andouille.  Jerky kielbasa shank bresaola turkey ground round tenderloin buffalo beef ribs capicola shankle corned beef.  Short loin capicola strip steak andouille hamburger, ribeye porchetta pastrami.  Turducken landjaeger meatball chicken.  Bacon pork loin tri-tip shank meatloaf flank kevin, ground round pancetta.  Sausage ham hock pig turducken, pork belly shoulder jowl sirloin pancetta fatback ground round leberkas.","6"
"16","Chislic ham beef tri-tip cupim prosciutto andouille pork belly meatloaf short ribs pork chop picanha.","Shankle sirloin spare ribs jerky, pork tenderloin ground round leberkas swine meatball pastrami biltong.  Shoulder short loin pork, tail short ribs spare ribs shank meatloaf flank pancetta pork loin cow prosciutto tongue.  Ball tip leberkas hamburger burgdoggen brisket.  Chicken ground round biltong, picanha bacon shank buffalo t-bone kielbasa pork salami kevin jowl boudin.  Pig turkey chuck shank andouille ground round salami pork.  Tenderloin pork kevin shank chuck capicola prosciutto.  Corned beef chicken tri-tip filet mignon, strip steak ham hock pork loin frankfurter capicola pig brisket tongue shankle beef ribs.","18"
"17","Chicken landjaeger porchetta, bresaola tenderloin shankle boudin beef ribs drumstick pancetta buffalo t-bone.","Ground round pork brisket, jowl chislic pastrami pig meatloaf sausage shankle.  Buffalo beef ribs doner venison pork loin swine bacon burgdoggen biltong picanha ribeye pork belly.  Tenderloin chislic picanha beef leberkas bacon.  Picanha venison salami pastrami ribeye.","7"
"18","Tongue shankle prosciutto biltong ball tip porchetta chuck brisket bacon tri-tip bresaola corned beef.","Pork belly cow ham venison.  Ground round doner pastrami chislic shankle shoulder porchetta, frankfurter jerky hamburger rump landjaeger alcatra pig.  Tri-tip brisket jerky pork, capicola shoulder pork chop beef ribs.  Bresaola ball tip burgdoggen porchetta.  Kevin bacon shoulder, ham hock t-bone doner pork loin beef ribs leberkas meatball jowl pancetta.  Swine turkey bacon kielbasa drumstick boudin buffalo, porchetta shank hamburger bresaola fatback beef ribs sirloin.  Brisket ham hock burgdoggen hamburger kielbasa biltong doner kevin tail tenderloin turkey landjaeger prosciutto.","18"
"19","Buffalo ham hamburger, pancetta frankfurter rump pig short ribs.","Flank bresaola pig venison cupim drumstick alcatra chislic doner leberkas.  Flank pastrami tail ham hock pork chop, bresaola filet mignon salami t-bone cow spare ribs doner sirloin ground round short ribs.  Venison porchetta beef short loin.  Picanha sirloin leberkas flank beef boudin hamburger kielbasa buffalo doner.  Boudin porchetta biltong beef ribs capicola.  Tongue chicken biltong, ham ham hock filet mignon strip steak brisket cupim swine fatback pastrami prosciutto beef.  Chuck brisket pork loin meatball venison cupim cow filet mignon.","18"
"20","Pork alcatra porchetta, pork chop t-bone burgdoggen doner meatball turkey.","Salami meatball shank venison meatloaf, capicola corned beef filet mignon sirloin.  Shankle jowl jerky, flank venison strip steak chislic pig.  Andouille rump landjaeger buffalo ham hock biltong jowl kevin.  Cupim ham pork swine bacon sausage frankfurter andouille fatback shoulder turkey kevin ham hock.  Beef ball tip pork chop ham hock.","3"
"21","Chuck landjaeger shank biltong pancetta.","Pork belly prosciutto tenderloin beef brisket doner corned beef boudin porchetta filet mignon.  Fatback pork belly ground round beef ribs tongue capicola bresaola landjaeger spare ribs sirloin biltong hamburger doner.  Meatloaf corned beef filet mignon doner burgdoggen rump.  Burgdoggen ham pork loin andouille alcatra kevin turkey sausage, brisket flank landjaeger tri-tip boudin.  Chuck t-bone bresaola burgdoggen ham hock strip steak.","8"
"22","Meatloaf flank doner burgdoggen turkey.","Tenderloin tongue ribeye andouille cow.  Turducken brisket shank venison, picanha t-bone spare ribs buffalo corned beef.  Corned beef pork loin biltong kevin t-bone brisket, beef ribs strip steak picanha swine tongue pig spare ribs tail.  Pastrami venison cow short loin, picanha t-bone chicken tenderloin turducken filet mignon meatball kielbasa capicola hamburger.  Cow swine salami, kielbasa pork loin tail beef ball tip ham chislic beef ribs.","8"
"23","Buffalo pastrami short loin, venison rump beef ribeye leberkas capicola ball tip kielbasa chuck jowl.","Biltong rump ground round spare ribs, chicken andouille chislic strip steak.  Turducken meatloaf tri-tip, salami biltong pig pork belly chuck t-bone kevin chicken short loin tenderloin venison.  Meatloaf hamburger chuck corned beef, ham hock boudin beef ribs shankle.  Chuck pancetta t-bone sausage andouille, tenderloin boudin kevin beef ribs short loin drumstick shoulder doner capicola.  Andouille ground round filet mignon flank.  Tenderloin tri-tip pork porchetta.  Capicola venison frankfurter shoulder ribeye sirloin.","20"
"24","Tri-tip brisket porchetta rump capicola.","Chuck boudin spare ribs brisket.  Frankfurter ribeye shank venison jerky short loin doner pork loin tenderloin buffalo ham hock.  Pork chop corned beef tenderloin ball tip turducken bresaola biltong pig chislic rump venison t-bone flank cow.  Biltong fatback pastrami ball tip tongue jowl.  Shankle beef ribs flank, drumstick ribeye corned beef pork burgdoggen strip steak.  Pork brisket shank swine meatloaf burgdoggen ground round venison turkey bacon salami flank.","5"
"25","Picanha spare ribs pork loin kevin frankfurter prosciutto t-bone tongue landjaeger alcatra ribeye pork belly ham short loin.","Sirloin chuck picanha kevin tongue pancetta.  T-bone corned beef swine pork loin spare ribs beef chicken boudin picanha.  Flank ham hock pastrami tri-tip, frankfurter pig venison alcatra brisket biltong.  Tail flank drumstick, porchetta filet mignon tri-tip strip steak chislic beef doner shank fatback meatball.  Ham hock pastrami picanha t-bone brisket, biltong prosciutto ham sirloin spare ribs shoulder hamburger doner tongue venison.","24"
"26","Turkey tenderloin venison bresaola pork loin sirloin tri-tip brisket drumstick pastrami spare ribs alcatra.","Venison ham hock pancetta, doner picanha meatloaf short loin strip steak swine salami leberkas pork turkey cow landjaeger.  Burgdoggen turkey ham, bresaola jowl turducken ham hock landjaeger pork chop meatball.  Porchetta kevin pancetta cupim, tail bacon chuck salami.  Ball tip t-bone boudin strip steak short loin tenderloin turkey sirloin.  Brisket beef ribs ball tip, burgdoggen turducken buffalo pork shank turkey frankfurter chuck cow.  Beef boudin sirloin spare ribs swine ham hock short loin chicken filet mignon capicola kevin hamburger pork venison.  Flank capicola burgdoggen boudin ball tip tail cupim short loin strip steak beef ribs porchetta.","6"
"27","Pancetta landjaeger prosciutto rump beef ribs.","Doner beef flank, biltong tongue hamburger jerky pork belly cow ham turkey.  Turducken short ribs pork loin cow capicola, frankfurter alcatra ground round biltong pancetta kielbasa tenderloin boudin t-bone ribeye.  Pig alcatra hamburger kevin boudin meatloaf strip steak beef.  Jowl filet mignon leberkas boudin beef.  Filet mignon pastrami spare ribs, jerky shank porchetta rump bacon tongue pork chop venison sausage frankfurter pig.","3"
"28","Filet mignon chicken salami jerky ground round, ribeye pork belly.","Pork belly turducken frankfurter, ball tip filet mignon ham hock cow prosciutto boudin buffalo beef ribs porchetta bresaola fatback.  Short loin chuck tail, meatloaf cupim beef ribs shoulder.  Kielbasa tongue pork belly beef ribs shankle.  Bresaola tenderloin venison sausage.  Meatloaf drumstick chuck chicken salami.","7"
"29","Kielbasa chislic burgdoggen alcatra pork belly tri-tip andouille meatloaf porchetta ground round biltong leberkas capicola fatback.","Ribeye fatback jerky boudin turkey biltong.  Jowl strip steak leberkas short loin, fatback burgdoggen alcatra andouille.  Picanha pork chop kielbasa ham hock bacon.  Shoulder buffalo brisket doner.","8"
"30","Porchetta andouille alcatra, tongue salami flank ham hock turkey corned beef spare ribs pork belly.","Brisket tongue prosciutto tri-tip sausage shankle.  Pork loin pancetta shankle, ham salami strip steak buffalo turducken tongue shoulder boudin chislic.  Chuck shankle doner, fatback t-bone corned beef pork alcatra biltong turducken prosciutto ham kielbasa bacon andouille.  Brisket pork loin tri-tip ham hock short ribs porchetta kielbasa rump pig chislic, jowl meatloaf venison burgdoggen.  Frankfurter kevin chuck pork t-bone swine burgdoggen turducken shankle.  Doner corned beef beef ribs jowl beef filet mignon ribeye sirloin fatback.  Brisket porchetta swine tongue t-bone kielbasa.","16"
"31","Sirloin doner hamburger, pork belly chislic chuck beef ribs bresaola.","Pastrami brisket venison drumstick chicken flank kevin, beef tenderloin.  Pork loin strip steak turducken, hamburger tail bacon pastrami ham hock pancetta ham chuck ribeye pork tongue.  Leberkas turkey brisket bresaola sausage, shankle bacon tri-tip cow shank.  Shoulder spare ribs tail ground round turkey.  Ribeye shoulder bresaola t-bone.","3"
"32","Strip steak leberkas pancetta fatback doner ham hock burgdoggen.","Hamburger tail bresaola cow kevin ribeye spare ribs alcatra meatball ball tip strip steak.  Buffalo pig pastrami salami.  Sausage tenderloin shoulder jowl, hamburger ground round pancetta beef ribeye tail ham hock filet mignon rump landjaeger alcatra.  Bresaola chislic ground round pork loin meatball buffalo sirloin andouille t-bone.  Porchetta turducken fatback, sirloin t-bone rump meatball short loin short ribs biltong beef.  Beef ribs bacon drumstick doner, short loin short ribs filet mignon ground round chislic spare ribs turkey pastrami jowl.  Buffalo pork kevin, turducken tenderloin ham pastrami ground round kielbasa chicken.","21"
"33","Sausage alcatra leberkas, turkey chislic short ribs pork chop cupim boudin brisket chuck.","Picanha turducken fatback swine chislic boudin ham hock, pork chop andouille burgdoggen prosciutto ribeye capicola ham.  Pork landjaeger picanha bacon ball tip sirloin corned beef biltong spare ribs meatloaf shank rump buffalo doner brisket.  Rump pancetta short ribs, pastrami jowl boudin cupim sirloin pork belly.  Doner bresaola flank shoulder.  Pig prosciutto ball tip, drumstick beef corned beef short ribs cow boudin andouille meatloaf t-bone porchetta turducken.  Chuck alcatra tenderloin filet mignon.","21"
"34","Pork belly capicola beef ribs pork chop bresaola.","Pancetta kevin brisket picanha strip steak ham hock venison chuck.  Salami leberkas ham pork chop buffalo pancetta biltong.  Doner t-bone porchetta tenderloin pancetta boudin sirloin capicola ground round pork loin.  Cupim porchetta ground round tenderloin, bacon turkey capicola kielbasa chislic shankle short loin jerky.  Leberkas pancetta sirloin shank, shoulder ham jerky capicola porchetta shankle.  Capicola sirloin andouille, ball tip tri-tip strip steak venison pork chop beef beef ribs.  Prosciutto short loin ham ham hock chuck corned beef t-bone.","9"
"35","Ball tip ground round swine burgdoggen beef.","Porchetta corned beef boudin turkey shankle.  Tongue chicken ball tip ribeye hamburger t-bone.  Shank flank landjaeger burgdoggen shankle venison.  Biltong pig fatback pork loin chicken shoulder filet mignon t-bone turkey sirloin bresaola doner jowl salami drumstick.  Brisket spare ribs turducken filet mignon.  Ham hock landjaeger frankfurter, beef buffalo corned beef pig kielbasa salami andouille short loin spare ribs ground round pork belly jerky.","24"
"36","Prosciutto ground round flank, landjaeger turducken hamburger fatback bresaola doner salami pancetta biltong alcatra.","Short loin chislic capicola pork buffalo picanha.  Corned beef chuck pastrami capicola sirloin picanha turducken meatloaf.  Cow frankfurter jowl pancetta pork belly jerky, ribeye sausage pork chop strip steak corned beef beef ribs swine venison andouille.  Shank prosciutto bresaola cupim, doner t-bone pancetta.  Pork loin flank kielbasa burgdoggen shank pancetta corned beef ribeye salami capicola tri-tip spare ribs sausage.  Brisket leberkas meatball chislic swine shoulder sirloin short loin ground round strip steak hamburger.","13"
"37","Ball tip jowl prosciutto picanha capicola.","Pork kielbasa bacon, rump boudin ball tip t-bone capicola alcatra pancetta chislic pork loin short loin brisket cow.  Leberkas bacon short ribs kielbasa sausage.  Ham shank leberkas, doner ball tip chuck tongue cupim jowl pastrami pancetta.  Cupim corned beef landjaeger kielbasa.  Swine jerky short loin flank ham hock ground round picanha pork, landjaeger rump shank fatback cow drumstick.  Meatloaf kielbasa drumstick, andouille picanha beef venison bresaola spare ribs ham pork chop tenderloin.","24"
"38","Beef salami pastrami turkey doner.","Chislic pastrami shankle buffalo swine venison andouille picanha biltong shank strip steak tenderloin.  Boudin cow ham drumstick.  Turducken tail pork belly beef, corned beef ham hock ball tip kielbasa chuck tongue beef ribs doner.  Pork chop burgdoggen beef ribs chicken, pork loin beef short loin salami chuck brisket chislic.  Porchetta cow venison, jowl doner landjaeger meatloaf.","14"
"39","Drumstick ground round spare ribs pork chop chuck ham hock meatloaf shankle.","Corned beef sirloin bacon prosciutto.  Jowl fatback drumstick sausage ground round, meatball beef ribs bacon tongue flank pork belly bresaola.  Pork fatback shank, ribeye pig t-bone drumstick chislic meatball spare ribs.  Andouille landjaeger swine capicola jowl, pork turkey shank.","12"
"40","Filet mignon chislic ribeye fatback, pork pork loin doner meatball strip steak hamburger leberkas.","Biltong bresaola jowl leberkas beef ribs cupim venison kevin capicola fatback meatball.  Meatloaf swine drumstick t-bone flank, venison chuck porchetta brisket strip steak hamburger cow buffalo corned beef salami.  Bresaola salami tongue rump flank chuck pork belly turkey ham hock brisket.  Pork chop strip steak shank capicola frankfurter.  Jowl pork belly fatback pork loin, turkey turducken flank cow doner tail leberkas shank drumstick landjaeger biltong.  Pig turkey spare ribs kielbasa.  Pig beef pancetta venison.","11"
"41","Beef ribs jowl frankfurter meatloaf, fatback ribeye venison andouille brisket bresaola spare ribs salami pastrami beef.","Porchetta sirloin pastrami jerky.  T-bone ribeye brisket meatloaf, hamburger sausage ham prosciutto meatball kielbasa short loin shoulder biltong.  Flank frankfurter short loin meatloaf, pig spare ribs tenderloin.  Sausage kevin cupim strip steak spare ribs, t-bone jerky.","14"
"42","Venison cupim drumstick pork loin fatback, pork salami ball tip beef ribs chuck ham hock tri-tip meatloaf.","Jowl pig flank alcatra tongue rump t-bone chicken sausage meatball ball tip.  Hamburger rump burgdoggen, tenderloin prosciutto sausage bacon ball tip ribeye venison tail.  Salami corned beef t-bone ham pork brisket beef biltong kielbasa tenderloin chislic sirloin sausage landjaeger pork loin.  Pancetta pork shank, biltong ground round filet mignon jerky landjaeger jowl doner andouille.  Turducken landjaeger rump leberkas sausage, kevin fatback spare ribs frankfurter flank porchetta ribeye.  Ball tip fatback beef ribs venison turkey buffalo, brisket capicola porchetta flank ham hock alcatra rump.  Spare ribs shankle alcatra, bresaola pancetta boudin pork belly short ribs sirloin.","8"
"43","T-bone cupim shank, jerky tail sausage tongue corned beef.","Meatloaf sausage pork loin fatback cupim venison tenderloin biltong corned beef frankfurter ball tip spare ribs.  Doner pork loin meatball sirloin flank tail porchetta fatback cupim.  Bresaola rump pork chop salami chicken jowl bacon corned beef swine ham boudin fatback shank.  Turducken pork meatball prosciutto strip steak, burgdoggen beef ribs.","6"
"44","Fatback sirloin cupim, salami chicken turkey ball tip ground round sausage beef.","T-bone short ribs brisket prosciutto biltong cow.  Corned beef biltong pork short loin flank beef ribs leberkas rump pork chop fatback swine, burgdoggen chuck short ribs.  Beef tongue burgdoggen, brisket shank pork jerky biltong.  Buffalo pig strip steak pancetta rump burgdoggen ham chislic pork chop salami drumstick.  Tri-tip beef capicola sausage chislic.","8"
"45","Venison beef shoulder, jowl pastrami capicola chicken jerky doner meatball ball tip.","Meatball kielbasa shank pig shoulder kevin.  Shankle short loin bresaola chicken chislic short ribs pork bacon rump.  Tenderloin bacon buffalo pastrami biltong burgdoggen.  Leberkas rump shank, biltong meatloaf tongue tri-tip chislic beef ribs shoulder tail chuck pastrami filet mignon.  Sausage short loin pork loin hamburger, andouille ribeye boudin cupim pork chop tenderloin.  Ground round meatloaf pastrami, swine brisket bresaola shoulder burgdoggen pork belly ball tip meatball jowl short loin.  Kielbasa bresaola sausage fatback alcatra filet mignon, pancetta hamburger chicken.","11"
"46","Leberkas meatball picanha tenderloin, pork chop turkey pork cupim biltong filet mignon jerky.","Pancetta t-bone frankfurter drumstick bacon shoulder alcatra.  Cupim pastrami pork sausage salami.  Pig turkey cupim tri-tip meatloaf beef filet mignon chislic corned beef ribeye.  Pork belly shank turkey leberkas, tongue sausage shoulder strip steak rump.  Landjaeger ham hock venison shankle cow strip steak pork boudin drumstick pancetta pork loin.  Meatloaf spare ribs flank meatball kevin chuck pastrami corned beef biltong bacon venison pork loin hamburger.","5"
